[
  {
    "id": "allah",
    "number": 1,
    "transliteration": "Allah",
    "arabic": "ٱللَّه",
    "urdu": "اللہ",
    "english": "The One God",
    "root": "أ-ل-ه",
    "rootMeaning": "To be worshipped",
    "category": "names-of-essential-nature",
    "occurrences": 2699,
    "meaning": {
      "en": "The greatest and most comprehensive name of Allah. It is the proper name of God that encompasses all His attributes. Unlike all other names, 'Allah' cannot be made plural, feminine, or derived into other forms — it is unique and absolute. Every other name of Allah is a description; this is His name.",
      "ur": "یہ اللہ کا ذاتی نام ہے جو تمام صفات کو محیط ہے۔ یہ نام نہ جمع ہو سکتا ہے نہ مؤنث — یہ مطلق اور منفرد ہے۔"
    },
    "inDailyLife": "When you say 'Bismillah' before any action, you invoke the complete reality of God. This name reminds you that all power, provision, and mercy flows from one single source.",
    "keyAyaat": [
      "2:255",
      "59:22",
      "59:23",
      "112:1"
    ],
    "related": [
      "al-hayy",
      "al-qayyum",
      "al-wahid",
      "al-ahad",
      "al-awwal",
      "al-akhir",
      "al-ghani",
      "al-baqi"
    ],
    "themes": [
      "asma-ul-husna",
      "tawheed",
      "dhikr"
    ]
  },
  {
    "id": "ar-rahman",
    "number": 2,
    "transliteration": "Ar-Rahman",
    "arabic": "ٱلرَّحْمَـٰن",
    "urdu": "بے حد رحم کرنے والا",
    "english": "The Most Gracious",
    "root": "ر-ح-م",
    "rootMeaning": "Womb-like tenderness, encompassing mercy",
    "category": "names-of-forgiveness-mercy",
    "occurrences": 57,
    "meaning": {
      "en": "Ar-Rahman describes Allah's vast, all-encompassing mercy that extends to every single created thing — believer and disbeliever, human and animal, seen and unseen. This mercy is active right now, in this moment. It is not earned. The linguistic root (rahma) shares its origin with the word for womb (rahim) — suggesting a mercy that is innate, unconditional, and life-giving.",
      "ur": "رحمان وہ ہے جس کی رحمت ہر چیز کو ڈھانپے ہوئے ہے — مومن ہو یا کافر۔ یہ رحمت بغیر کسی کے مانگے ملتی ہے۔"
    },
    "inDailyLife": "Every morning you wake up is Ar-Rahman in action. Every breath, every heartbeat is unearned mercy. When you feel unworthy of God's attention, remember — Ar-Rahman's mercy does not require your worthiness.",
    "keyAyaat": [
      "1:3",
      "2:163",
      "17:110",
      "20:5",
      "55:1",
      "59:22"
    ],
    "related": [
      "ar-rahim",
      "al-ghaffar",
      "al-halim",
      "al-ghafur",
      "al-barr",
      "at-tawwab",
      "al-afuww",
      "ar-rauf"
    ],
    "themes": [
      "asma-ul-husna",
      "rahmah",
      "hope-raja"
    ]
  },
  {
    "id": "ar-rahim",
    "number": 3,
    "transliteration": "Ar-Rahim",
    "arabic": "ٱلرَّحِيم",
    "urdu": "بار بار رحم کرنے والا",
    "english": "The Most Merciful",
    "root": "ر-ح-م",
    "rootMeaning": "Mercy that returns repeatedly",
    "category": "names-of-forgiveness-mercy",
    "occurrences": 95,
    "meaning": {
      "en": "While Ar-Rahman is the vast mercy given to all creation without condition, Ar-Rahim is the specific, focused mercy Allah reserves especially for the believers — particularly in the Hereafter. Ar-Rahman is the ocean; Ar-Rahim is the river directed toward those who turn to Him.",
      "ur": "رحیم وہ رحمت ہے جو بار بار آتی ہے اور خاص طور پر مومنوں کے لیے آخرت میں ظاہر ہوگی۔ رحمان عام ہے، رحیم خاص۔"
    },
    "inDailyLife": "When you repent after making a mistake, you are turning to Ar-Rahim — the mercy that comes back to you again and again, no matter how many times you fall.",
    "keyAyaat": [
      "1:3",
      "2:37",
      "2:54",
      "2:128",
      "4:100",
      "33:43",
      "48:14"
    ],
    "related": [
      "ar-rahman",
      "al-ghaffar",
      "al-halim",
      "al-ghafur",
      "ash-shakur",
      "at-tawwab",
      "al-afuww",
      "ar-rauf"
    ],
    "themes": [
      "asma-ul-husna",
      "rahmah",
      "tawbah",
      "hope-raja"
    ]
  },
  {
    "id": "al-malik",
    "number": 4,
    "transliteration": "Al-Malik",
    "arabic": "ٱلْمَلِك",
    "urdu": "بادشاہ",
    "english": "The Absolute Sovereign",
    "root": "م-ل-ك",
    "rootMeaning": "To possess, to govern",
    "category": "names-of-power-sovereignty",
    "occurrences": 5,
    "meaning": {
      "en": "Al-Malik is the King whose dominion is absolute, unconditional, and eternal. Human kings borrow their authority, lose it, and die. Al-Malik owns everything inherently — nothing in creation exists outside His kingdom. On the Day of Judgment, all pretended sovereignties dissolve and only Al-Malik remains (40:16).",
      "ur": "اللہ وہ بادشاہ ہے جس کی بادشاہت حقیقی اور ابدی ہے۔ دنیا کے بادشاہ عاریتی اقتدار رکھتے ہیں — اللہ کی ملکیت ذاتی اور مطلق ہے۔"
    },
    "inDailyLife": "When you feel powerless before worldly authorities, Al-Malik reminds you that the ultimate authority rests elsewhere. No decree of any earthly king can override His.",
    "keyAyaat": [
      "20:114",
      "23:116",
      "59:23",
      "62:1",
      "114:2"
    ],
    "related": [
      "al-muhaymin",
      "al-aziz",
      "al-jabbar",
      "al-mutakabbir",
      "malik-ul-mulk",
      "dhul-jalali-wal-ikram",
      "al-mani",
      "ad-darr"
    ],
    "themes": [
      "asma-ul-husna",
      "tawheed",
      "leadership",
      "akhirah"
    ]
  },
  {
    "id": "al-quddus",
    "number": 5,
    "transliteration": "Al-Quddus",
    "arabic": "ٱلْقُدُّوس",
    "urdu": "پاک ذات",
    "english": "The Most Pure, The Holy",
    "root": "ق-د-س",
    "rootMeaning": "To be pure, free of all defect",
    "category": "names-of-holiness",
    "occurrences": 2,
    "meaning": {
      "en": "Al-Quddus is absolutely free from every imperfection, limitation, deficiency, and defect — in His essence, attributes, and actions. Everything in creation has some flaw; Al-Quddus is transcendent beyond all of them. The angels constantly declare His holiness.",
      "ur": "قدوس وہ ہے جو ہر عیب، کمزوری اور نقص سے پاک ہے۔ فرشتے اس کی تسبیح کرتے ہیں۔"
    },
    "inDailyLife": "When you doubt whether Allah could be just given the suffering you see, Al-Quddus answers — His wisdom is pure of any injustice.",
    "keyAyaat": [
      "59:23",
      "62:1"
    ],
    "related": [],
    "themes": [
      "asma-ul-husna",
      "tawheed",
      "dhikr"
    ]
  },
  {
    "id": "as-salam",
    "number": 6,
    "transliteration": "As-Salam",
    "arabic": "ٱلسَّلَام",
    "urdu": "سلامتی دینے والا",
    "english": "The Source of Peace",
    "root": "س-ل-م",
    "rootMeaning": "Peace, wholeness, freedom from defect",
    "category": "names-of-peace-security",
    "occurrences": 1,
    "meaning": {
      "en": "As-Salam is the source and embodiment of all peace — He Himself is free from every deficiency, and He is the giver of peace to His creation. The greeting of the people of Jannah will be 'Salam' (14:23), and Jannah itself is called Dar as-Salam — the Abode of Peace.",
      "ur": "السلام وہ ہے جو خود سلامتی کا سرچشمہ ہے۔ جنت کو 'دارالسلام' اسی لیے کہا گیا کہ وہاں حقیقی سکون ہوگا۔"
    },
    "inDailyLife": "Anxiety often comes from seeking peace in things that cannot give it. As-Salam is a reminder that peace is a Person to turn to, not a circumstance to achieve.",
    "keyAyaat": [
      "59:23"
    ],
    "related": [
      "al-mumin"
    ],
    "themes": [
      "asma-ul-husna",
      "anxiety-fear",
      "jannah"
    ]
  },
  {
    "id": "al-mumin",
    "number": 7,
    "transliteration": "Al-Mu'min",
    "arabic": "ٱلْمُؤْمِن",
    "urdu": "امان دینے والا",
    "english": "The Granter of Security",
    "root": "أ-م-ن",
    "rootMeaning": "Security, faith, trust",
    "category": "names-of-peace-security",
    "occurrences": 1,
    "meaning": {
      "en": "Al-Mu'min gives security and safety to His creation. He is the source of iman itself. He testified to His own oneness (3:18), and He grants the believer the security of faith — that deep internal steadiness that cannot be shaken by external events.",
      "ur": "المومن وہ ہے جو امن اور ایمان عطا کرتا ہے۔ مومن کو جو دل کا سکون ملتا ہے وہ اسی نام کا عطیہ ہے۔"
    },
    "inDailyLife": "When you feel unsafe in the world, Al-Mu'min is the ultimate guarantor of security. The physical world may be unpredictable, but His protection of your soul is absolute.",
    "keyAyaat": [
      "59:23"
    ],
    "related": [
      "as-salam"
    ],
    "themes": [
      "asma-ul-husna",
      "anxiety-fear",
      "iman"
    ]
  },
  {
    "id": "al-muhaymin",
    "number": 8,
    "transliteration": "Al-Muhaymin",
    "arabic": "ٱلْمُهَيْمِن",
    "urdu": "نگہبان",
    "english": "The Guardian, The Overseer",
    "root": "ه-ي-م-ن",
    "rootMeaning": "To watch over, to protect, to be witness",
    "category": "names-of-power-sovereignty",
    "occurrences": 1,
    "meaning": {
      "en": "Al-Muhaymin watches over all things, protects them, and is fully aware of every detail. Nothing escapes His observation. He oversees the Quran as the guardian of all previous scriptures (5:48). He observes every secret thought, every hidden action — not as surveillance, but as protection.",
      "ur": "المہیمن ہر چیز پر نگہبان ہے۔ قرآن کو بھی 'مہیمن' کہا گیا ہے کیونکہ وہ پچھلی کتابوں کا محافظ ہے۔"
    },
    "inDailyLife": "Every good deed done in private, every sacrifice no one saw — Al-Muhaymin witnessed it all. When you worry your good deeds go unnoticed, He has witnessed every one of them.",
    "keyAyaat": [
      "59:23"
    ],
    "related": [
      "al-malik",
      "al-aziz",
      "al-jabbar",
      "al-mutakabbir",
      "al-qahhar",
      "dhul-jalali-wal-ikram",
      "al-mani",
      "ad-darr"
    ],
    "themes": [
      "asma-ul-husna",
      "taqwa",
      "ikhlas",
      "revelation"
    ]
  },
  {
    "id": "al-aziz",
    "number": 9,
    "transliteration": "Al-Aziz",
    "arabic": "ٱلْعَزِيز",
    "urdu": "غالب",